{
  "$schema": "./schemas/brand.schema.json",
  "version": 1,
  "studio": "TokenLimit",
  "game": {
    "name": "Kehai",
    "japanese": "気配",
    "russian": "Кэхай",
    "tagline": { "en": "The sense that someone is there.", "ru": "Ощущение, что кто-то рядом." }
  },
  "antagonist": { "name": "Karen", "japanese": "カレン", "russian": "Карен", "pronoun": "she" },
  "handles": { "youtube": null, "instagram": null, "tiktok": null, "x": null, "bluesky": null },
  "links": { "website": null, "steam": null, "discord": null },
  "colours": {
    "crimson": "#DC143C",
    "ink": "#151518",
    "inkSoft": "#2A2A30",
    "paper": "#FFFFFF",
    "mist": "#B8B5B2",
    "game": { "karen": "#FF5454", "you": "#4DD2FF", "guess": "#FFD640" }
  },
  "fonts": {
    "display": { "family": "Nunito", "weight": 900 },
    "body": { "family": "Nunito", "weight": 700 },
    "japanese": { "family": "M PLUS Rounded 1c", "weight": 800 },
    "source": "Google Fonts (SIL Open Font License), loaded at render time; never committed"
  },
  "voices": {
    "proposed": true,
    "note": "Q10 is open: the recommended Azure neural voices until the owner picks from samples (voice_samples.py). `say` is the macOS stand-in used without a key; `elevenlabs` is a voice id for that backend.",
    "backend": "azure",
    "en": {
      "narrator": { "azure": "en-US-AndrewNeural", "rate": "+0%", "pitch": "+0%", "say": "Samantha", "elevenlabs": null },
      "karen": { "azure": "en-US-AvaNeural", "rate": "-6%", "pitch": "-3%", "say": "Shelley", "elevenlabs": null }
    },
    "ru": {
      "narrator": { "azure": "ru-RU-DmitryNeural", "rate": "+0%", "pitch": "+0%", "say": "Milena", "elevenlabs": null },
      "karen": { "azure": "ru-RU-SvetlanaNeural", "rate": "-6%", "pitch": "-3%", "say": "Milena", "elevenlabs": null }
    }
  }
}
